{
  "schemaVersion": "1.0.0",
  "entity": {
    "name": "Nimbus Cartography Collective",
    "aliases": [
      "Nimbus Collective",
      "Nimbus"
    ]
  },
  "generatedAt": "2026-08-13T12:00:00Z",
  "sources": [
    {
      "id": "src-01",
      "date": "2021-03-14",
      "title": "Nimbus Cartography Collective: A Brief History"
    },
    {
      "id": "src-02",
      "date": "2022-08-02",
      "title": "Profile: Inside the Nimbus Collective"
    }
  ],
  "claims": [
    {
      "id": "c1",
      "text": "The Nimbus Cartography Collective was founded in 2011.",
      "citations": [
        {
          "sourceId": "src-01",
          "quote": "The Nimbus Cartography Collective was founded in 2011 by four cartographers working out of a shared studio in Rotterdam."
        }
      ]
    },
    {
      "id": "c2",
      "text": "Nimbus began operations in early 2012, according to the organisation's own first annual report.",
      "citations": [
        {
          "sourceId": "src-02",
          "quote": "Nimbus began operations in early 2012, according to the organisation's own first annual report."
        }
      ]
    },
    {
      "id": "c3",
      "text": "The Nimbus Cartography Collective was founded by four cartographers.",
      "citations": [
        {
          "sourceId": "src-01",
          "quote": "founded in 2011 by four cartographers working out of a shared studio in Rotterdam"
        }
      ]
    },
    {
      "id": "c4",
      "text": "The founders worked out of a shared studio in Rotterdam.",
      "citations": [
        {
          "sourceId": "src-01",
          "quote": "working out of a shared studio in Rotterdam"
        }
      ]
    },
    {
      "id": "c5",
      "text": "The collective began as a volunteer effort to map flood-prone neighbourhoods that commercial map providers had ignored.",
      "citations": [
        {
          "sourceId": "src-01",
          "quote": "It began as a volunteer effort to map flood-prone neighbourhoods that commercial map providers had ignored."
        }
      ]
    },
    {
      "id": "c6",
      "text": "By 2019 the collective employed twelve people.",
      "citations": [
        {
          "sourceId": "src-01",
          "quote": "By 2019 the collective employed twelve people and had published atlases for three Dutch provinces."
        }
      ]
    },
    {
      "id": "c7",
      "text": "By 2019 the collective had published atlases for three Dutch provinces.",
      "citations": [
        {
          "sourceId": "src-01",
          "quote": "had published atlases for three Dutch provinces"
        }
      ]
    },
    {
      "id": "c8",
      "text": "The collective is headquartered in Rotterdam.",
      "citations": [
        {
          "sourceId": "src-01",
          "quote": "working out of a shared studio in Rotterdam"
        },
        {
          "sourceId": "src-02",
          "quote": "The collective is headquartered in Rotterdam"
        }
      ]
    },
    {
      "id": "c9",
      "text": "The collective runs open-data mapping projects across the Netherlands.",
      "citations": [
        {
          "sourceId": "src-02",
          "quote": "today runs open-data mapping projects across the Netherlands"
        }
      ]
    }
  ],
  "groups": [
    {
      "id": "g1",
      "question": "When was the Nimbus Cartography Collective founded or when did it begin operations?",
      "claimIds": [
        "c1",
        "c2"
      ],
      "status": "disputed"
    },
    {
      "id": "g2",
      "question": "How many founders established the Nimbus Cartography Collective?",
      "claimIds": [
        "c3"
      ],
      "status": "agreed"
    },
    {
      "id": "g3",
      "question": "Where did the founders initially work?",
      "claimIds": [
        "c4"
      ],
      "status": "agreed"
    },
    {
      "id": "g4",
      "question": "What was the collective's original purpose?",
      "claimIds": [
        "c5"
      ],
      "status": "agreed"
    },
    {
      "id": "g5",
      "question": "How many people did the collective employ by 2019?",
      "claimIds": [
        "c6"
      ],
      "status": "agreed"
    },
    {
      "id": "g6",
      "question": "How many Dutch provinces had the collective published atlases for by 2019?",
      "claimIds": [
        "c7"
      ],
      "status": "agreed"
    },
    {
      "id": "g7",
      "question": "Where is the Nimbus Cartography Collective headquartered?",
      "claimIds": [
        "c8"
      ],
      "status": "agreed"
    },
    {
      "id": "g8",
      "question": "What kind of projects does the collective run today?",
      "claimIds": [
        "c9"
      ],
      "status": "agreed"
    }
  ],
  "model": "minimax-m3"
}
